{
    "schema_version":  "1.0.0",
    "corpus_id":  "learnpilot-rag-demo-corpus",
    "corpus_version":  "v1",
    "documents":  [
                      {
                          "document_id":  "lp-rag-v1-a01",
                          "title":  "从问题到候选片段",
                          "topic":  "rag_retrieval",
                          "source_type":  "project_owned_runtime_contract",
                          "source_reference":  "backend/app/services/rag/query_rewriter.py; backend/app/services/vector_store/service.py; backend/app/services/vector_store/manifest.py",
                          "version_or_date":  "2026-08-13",
                          "language":  "zh-CN",
                          "expected_ingestion_type":  "md",
                          "repository_path":  "evals/rag_demo_corpus/v1/corpus/rag-query-to-candidate-retrieval.md",
                          "sha256":  "8c705a715bf19353317036e4e5206518ac1c5b4354903f555d436ff138309c49",
                          "notes":  "查询改写、Embedding、FAISS 候选回查，以及“无独立 reranker”的运行时事实。"
                      },
                      {
                          "document_id":  "lp-rag-v1-a02",
                          "title":  "排序、去重与上下文预算",
                          "topic":  "rag_retrieval",
                          "source_type":  "project_owned_runtime_contract",
                          "source_reference":  "backend/app/services/rag/retrieval.py; backend/app/core/config.py",
                          "version_or_date":  "2026-08-13",
                          "language":  "zh-CN",
                          "expected_ingestion_type":  "md",
                          "repository_path":  "evals/rag_demo_corpus/v1/corpus/rag-ranking-filtering-and-context.md",
                          "sha256":  "78b95731d1d1ea5be3ee6c29c7fe9912734b513989069da63950cb222261c996",
                          "notes":  "与 A01 语义相近但聚焦候选后处理、资料多样性和字符预算，支持排序辨析与多事实问题。"
                      },
                      {
                          "document_id":  "lp-rag-v1-a03",
                          "title":  "Grounded Answer 与引用契约",
                          "topic":  "rag_retrieval",
                          "source_type":  "project_owned_runtime_contract",
                          "source_reference":  "backend/app/services/rag/prompts.py; backend/app/services/rag/grounding.py; backend/app/services/rag/validation.py; backend/app/models/rag_citation.py",
                          "version_or_date":  "2026-08-13",
                          "language":  "zh-CN",
                          "expected_ingestion_type":  "md",
                          "repository_path":  "evals/rag_demo_corpus/v1/corpus/rag-grounded-answer-and-citations.md",
                          "sha256":  "5afa03450fd966adbc95e93c8cc264c8f2837dda8c01c89d762406c0fe541c05",
                          "notes":  "回答 evidence blocks、后端引用渲染和 Citation 快照的 canonical contract。"
                      },
                      {
                          "document_id":  "lp-rag-v1-a04",
                          "title":  "索引生命周期、重复导入与删除",
                          "topic":  "rag_retrieval",
                          "source_type":  "project_owned_runtime_contract",
                          "source_reference":  "backend/app/services/materials.py; backend/app/services/material_processing/pipeline.py; backend/app/services/vector_store/service.py; backend/app/services/material_deletion.py",
                          "version_or_date":  "2026-08-13",
                          "language":  "zh-CN",
                          "expected_ingestion_type":  "md",
                          "repository_path":  "evals/rag_demo_corpus/v1/corpus/rag-index-lifecycle-and-deletion.md",
                          "sha256":  "994f6e4cae09a22bcc9d134b3ac515597a0c3ed7718e754553ae85a32bcc07f0",
                          "notes":  "重复上传、重新处理、全量 rebuild 与删除清理，适合 citation-sensitive 生命周期问题。"
                      },
                      {
                          "document_id":  "lp-rag-v1-b01",
                          "title":  "Agent 计划与工具限额",
                          "topic":  "agent_engineering",
                          "source_type":  "project_owned_runtime_contract",
                          "source_reference":  "backend/app/services/agent/graph.py; backend/app/services/agent/tools.py; docs/agent-architecture.md",
                          "version_or_date":  "2026-08-13",
                          "language":  "zh-CN",
                          "expected_ingestion_type":  "md",
                          "repository_path":  "evals/rag_demo_corpus/v1/corpus/agent-plan-and-tool-limits.md",
                          "sha256":  "3eeee24a595b4631760b18b3184e7a9e4b3dfd7659eabe82d65a427aa7acf570",
                          "notes":  "聚焦四步/三读/一写和先读后写，和 B02/B03 形成相似但可区分的 Agent 文档组。"
                      },
                      {
                          "document_id":  "lp-rag-v1-b02",
                          "title":  "Agent 确认、恢复与幂等",
                          "topic":  "agent_engineering",
                          "source_type":  "project_owned_runtime_contract",
                          "source_reference":  "backend/app/services/agent/runtime.py; backend/app/services/agent/service.py; backend/app/models/agent.py; docs/agent-checkpoint.md",
                          "version_or_date":  "2026-08-13",
                          "language":  "zh-CN",
                          "expected_ingestion_type":  "md",
                          "repository_path":  "evals/rag_demo_corpus/v1/corpus/agent-confirmation-and-idempotency.md",
                          "sha256":  "1924e60c9f28b85a6e8df94b7417256cfb917aafc2aa79431bf8d7215d3da9a7",
                          "notes":  "冻结参数、interrupt/resume、thread ID、快照哈希和重复批准语义。"
                      },
                      {
                          "document_id":  "lp-rag-v1-b03",
                          "title":  "Agent 数据与安全边界",
                          "topic":  "agent_engineering",
                          "source_type":  "project_owned_runtime_contract",
                          "source_reference":  "backend/app/services/agent/tools.py; backend/app/services/rag/prompts.py; docs/agent-security.md",
                          "version_or_date":  "2026-08-13",
                          "language":  "zh-CN",
                          "expected_ingestion_type":  "md",
                          "repository_path":  "evals/rag_demo_corpus/v1/corpus/agent-data-and-security-boundaries.md",
                          "sha256":  "5182103b660ff8ea628bb91c7e5e797797b76364b309464541bcfeeb6aa1c12d",
                          "notes":  "普通安全边界说明；攻击文本仍留在专用 fixture，不混入 demo corpus。"
                      },
                      {
                          "document_id":  "lp-rag-v1-c01",
                          "title":  "AI 应用后端的分层接口",
                          "topic":  "ai_app_backend",
                          "source_type":  "project_owned_runtime_contract",
                          "source_reference":  "backend/app/api/routes/rag.py; backend/app/schemas/rag.py; backend/app/services/rag/service.py; docs/architecture.md",
                          "version_or_date":  "2026-08-13",
                          "language":  "zh-CN",
                          "expected_ingestion_type":  "md",
                          "repository_path":  "evals/rag_demo_corpus/v1/corpus/backend-layering-and-api-contracts.md",
                          "sha256":  "e7f03faa3b333d3dec8ac57d376c0dd22c695d2a372606c504630f596f0a504c",
                          "notes":  "HTTP、schema、module、repository、模型与经过校验的 SSE 接口。"
                      },
                      {
                          "document_id":  "lp-rag-v1-c02",
                          "title":  "持久化与事务边界",
                          "topic":  "ai_app_backend",
                          "source_type":  "project_owned_runtime_contract",
                          "source_reference":  "backend/app/services/material_processing/pipeline.py; backend/app/services/vector_store/faiss_store.py; backend/app/services/rag/service.py",
                          "version_or_date":  "2026-08-13",
                          "language":  "zh-CN",
                          "expected_ingestion_type":  "md",
                          "repository_path":  "evals/rag_demo_corpus/v1/corpus/backend-persistence-and-transactions.md",
                          "sha256":  "87efec8b1d969fab2a49562c9c0292e0fbaeed7d8cd6991eea8b1285847012a1",
                          "notes":  "区分业务 SQLite、checkpoint SQLite 与可重建 FAISS，并说明跨存储收敛。"
                      },
                      {
                          "document_id":  "lp-rag-v1-c03",
                          "title":  "资料解析、清洗与切块契约",
                          "topic":  "ai_app_backend",
                          "source_type":  "project_owned_runtime_contract",
                          "source_reference":  "backend/app/services/material_processing/parsers; backend/app/services/material_processing/cleaning.py; backend/app/services/material_processing/chunking.py",
                          "version_or_date":  "2026-08-13",
                          "language":  "zh-CN",
                          "expected_ingestion_type":  "md",
                          "repository_path":  "evals/rag_demo_corpus/v1/corpus/backend-material-processing.md",
                          "sha256":  "bc0402d85544541bd8ac7bc2b6b27592d812fdd7a26cda1d69c77db92fdd9dc9",
                          "notes":  "覆盖 PDF/Markdown/TXT、metadata 传播和默认 chunk 参数。"
                      },
                      {
                          "document_id":  "lp-rag-v1-d01",
                          "title":  "评测隔离与夹具边界",
                          "topic":  "evaluation_production_reliability",
                          "source_type":  "project_owned_runtime_contract",